question,options,right_answer
"当代中国共产党人和中国人民应该而且一定能够担负起新的文化使命,在实践创造中进行文化创造,在历史进步中实现文化进步！","['正确', '错误']",['正确']
中国共产党党内斗争方针是(),"['残酷斗争', '惩前毖后,治病救人', '批评和自我批评', '实事求是']","['惩前毖后,治病救人']"
党性说到底就是()问题.,"['原则', '立场', '政治', '组织']",['立场']
"1984年2月至7月,在中共中央编辑委员会指导下,由中共中央书记处研究室编辑、中共中央文献研究室参加审核和校阅的()由人民出版社出版,向全国发行.","['《周恩来选集》', '《陈云文选》', '《邓小平文选》']",['《陈云文选》']
"1992年12月14日至18日,国务院在北京召开全国计划会议.李鹏在会上强调：社会主义市场经济包括了市场和计划两种调控手段,必须十分重视培育和发展各类市场,发挥市场在().","['经济生活中的调节作用', '供销环节上的控制作用资源配置中的基础作用', '资源配置中的基础作用']",['资源配置中的基础作用']
"预备党员预备期满,()应当及时讨论他能否转为正式党员.","['党小组', '入党介绍人', '党的支部']",['党的支部']
党的十五大报告明确提出()是我国社会主义初级阶段的一项基本经济制度.,"['公有制为主体、多种所有制经济共同发展', '按劳分配为主体、多种分配方式并存', '家庭联产承包责任制', '社会主义市场经济']",['公有制为主体、多种所有制经济共同发展']
党的全国代表大会每()年举行一次,"['二', '四', '五', '十']",['五']
"在近代中国社会的诸多矛盾中,最主要的矛盾是()","['帝国主义与中华民族的矛盾', '封建主义与人民大众的矛盾', '反动统治阶级内部的矛盾', '资产阶级与无产阶级的矛盾']",['帝国主义与中华民族的矛盾']
党组发挥()作用.,"['领导', '核心', '领导核心']",['领导']
"2022年10月16日,习近平在党的二十大报告中指出,前进道路上,必须牢牢把握以下重大原则：坚持和加强(),坚持(),坚持(),坚持(),坚持发扬().","['党的全面领导', '中国特色社会主义道路', '以人民为中心的发展思想', '深化改革开放']","['党的全面领导', '中国特色社会主义道路', '以人民为中心的发展思想', '深化改革开放']"
"1922年1月到1923年2月,在中国共产党的领导下,掀起了第一次农民运动高潮.","['正确', '错误']",['错误']
"党的基层委员会、总支部委员会、支部委员会每届任期____.基层委员会、总支部委员会、支部委员会的书记、副书记选举产生后,应报上级党组织批准.","['一至两年', '两至三年', '三至四年', '三至五年']",['三至五年']
共产党人要按照()办事情.,"['客观规律', '上级安排', '媒体监督', '人民呼声']",['客观规律']
"与中共“一大”相比较,中共“二大”最重要的贡献是确定了().","['以工人运动为中心任务', '在民主革命阶段的纲领', '民主集中制的组织原则', '为共产主义奋斗的目标']",['在民主革命阶段的纲领']
"一九二一年中国共产党应运而生.从此,中国人民谋求民族独立、人民解放和国家富强、人民幸福的斗争就有了主心骨,中国人民就从精神上由被动转为主动.","['正确', '错误']",['正确']
"党的中央、地方和基层组织,都必须重视党的建设,经常讨论和检查党的()、()、()、()、群众工作、统一战线工作等,注意研究党内外的思想政治状况.","['宣传工作', '组织工作', '教育工作', '纪律检查工作']","['宣传工作', '组织工作', '教育工作', '纪律检查工作']"
"下列选项中,属于党员义务的是().","['密切联系群众', '维护党的团结和统一', '坚持党和人民的利益高于一切', '学习党的基本知识和党的历史']","['密切联系群众', '维护党的团结和统一', '坚持党和人民的利益高于一切', '学习党的基本知识和党的历史']"
"1953年12月至1954年3月,毛泽东在杭州主持起草第一部().","['《全国农业发展纲领(草案)》', '《中华人民共和国宪法(草案)》', '《全国工业发展条例》']",['《中华人民共和国宪法(草案)》']
"完善社会主义市场经济体制,要按照()和对外开放的要求,更大程度地发挥市场在资源配置中的基础性作用,增强企业活力和竞争力,健全国家宏观调控,完善政府社会管理和公共服务职能,为全面建设小康社会提供强有力的体制保障","['统筹城乡发展', '统筹区域发展', '统筹经济社会发展', '统筹人与自然和谐发展', '统筹国内发展']","['统筹城乡发展', '统筹区域发展', '统筹经济社会发展', '统筹人与自然和谐发展', '统筹国内发展']"
未来十年是全面建设社会主义现代化国家开局起步的关键时期.,"['正确', '错误']",['错误']
"1907年,詹天佑主持修建,()是我国第一座完全由中国人自行设计施工建成的越岭铁路隧道.","['八达岭隧道', '狮球岭隧道', '武胜关隧道', '秦岭隧道']",['八达岭隧道']
"1949年9月21日,()第一届全体会议在北平隆重开幕.毛泽东在开幕词中庄严地宣告:“占人类总数四分之一的中国人从此站立起来了.","['中国人民代表大会', '中国人民政治协商会议', '政务院会议', '中央政治局会议']",['中国人民政治协商会议']
"在资本主义工商业的社会主义改造中,实行个别企业的公私合营是：()","['初级形式的国家资本主义', '高级形式的国家资本主义', '合作化的最初表现形式', '合作化的最高表现形式']",['合作化的最初表现形式']
"柔软的石墨和坚硬无比的金刚石,都是由()元素构成的,但是其硬度却有天壤之别.","['钠', '氢', '碳', '氧']",['碳']
“三个代表”重要思想创造性地回答了(),"['“建设什么样的党,怎样建设党”的问题', '“什么是社会主义,怎样建设社会主义”的问题', '“什么是发展,怎样发展”的问题', '什么是社会和谐,怎样构建社会主义和谐社会']","['“建设什么样的党,怎样建设党”的问题']"
下列石窟被誉为“东方塑像馆”的是().,"['龙门石窟', '麦积山石窟', '云冈石窟', '敦煌莫高窟']",['麦积山石窟']
"十八大以来,党中央召开七次全会,分别就政府机构改革和职能转变、全面深化改革、全面推进依法治国、制定“十三五”规划、全面从严治党等重大问题作出决定和部署.","['正确', '错误']",['正确']
"十九大中,伟大斗争,伟大工程,伟大事业,伟大梦想,紧密联系、相互贯通、相互作用,其中起决定性作用的是党的建设新的伟大工程.","['正确', '错误']",['正确']
"1995年4月7日,《人民日报》发表长篇通讯《领导干部的楷模()》,介绍他在西藏的先进事迹.","['李国安', '孔繁森', '吴天祥']",['孔繁森']
1935年1月召开的遵义会议解決了当时最为迫切的(),"['政治问题和组织问题', '军事问题和组织问题', '思想问题和组织问题', '思想问题和作风问题']",['军事问题和组织问题']
中国无产阶级的“特殊优点”在于().,"['不占有任何生产资料', '人数虽少,但比较集中', '深受帝国主义、封建主义和官僚资本主义的三重压迫', '与农民有着天然的联系']","['人数虽少,但比较集中', '深受帝国主义、封建主义和官僚资本主义的三重压迫', '与农民有着天然的联系']"
"社会主义初级阶段,包括两层含义:第一,我国社会已经是社会主义社会,我们必须坚持而不能离开社会主义.第二,我国的社会主义社会还处在起始阶段,我们必须从这个实际出发,而不能超越这个阶段.","['正确', '错误']",['错误']
"党的十八大在谈到：人民民主不断扩大.民主制度更加完善,民主形式更加丰富,依法治国基本方略全面落实,法治政府基本建成,司法公信力不断提高,民权得到切实尊重和保障.","['正确', '错误']",['正确']
"1989年3月4日,邓小平在同中央负责同志谈话时指出中国的问题压倒一切的是需要稳定","['正确', '错误']",['正确']
"按照中共十九大的要求,中央济工作会议确定今后三年要重点抓好决胜全面建成小康社会的防范化解重大风险、精准脱贫、污染防治三大攻坚战.","['正确', '错误']",['正确']
我国社会主义建设的战略目标是(),"['实现农业、工业、国防和科技现代化', '实现工业化和经济的社会化、市场化和现代化', '实现经济、政治、文化现代化', '把我国建设成为富强、民主、文明的社会主义现代化国家']",['把我国建设成为富强、民主、文明的社会主义现代化国家']
以下属于新时代党的组织路线内容的是().,"['在实践中检验真理和发展真理', '着力培养忠诚干净担当的高素质干部', '以组织体系建设为重点', '全面贯彻习近平新时代中国特色社会主义思想']","['着力培养忠诚干净担当的高素质干部', '以组织体系建设为重点', '全面贯彻习近平新时代中国特色社会主义思想']"
"2023年4月3日,习近平在学习贯彻习近平新时代中国特色社会主义思想主题教育工作会议上指出,要实干担当促进发展,教育引导广大党员、干部胸怀“()”,紧紧围绕新时代新征程党的中心任务,真抓实干、务求实效,聚焦问题、知难而进,以()的责任感、()的精气神为党和人民履好职、尽好责,以新气象新作为推动高质量发展取得新成效,依靠()打开事业发展新天地.","['国之大者', '时时放心不下', '积极担当作为', '顽强斗争']","['国之大者', '时时放心不下', '积极担当作为', '顽强斗争']"
"党组织决定重要问题,要进行表决.对于少数人的不同意见,应当认真考虑.如对重要问题发生争论,双方人数接近,下列说法错误的是().","['在特殊情况下,可将争论情况向上级组织报告,请求裁决', '除了在紧急情况下应当由党组织书记作出决定外,必须按多数意见,尽快执行', '在特殊情况下,可将争论情况向上级组织报告,请求裁决']","['除了在紧急情况下应当由党组织书记作出决定外,必须按多数意见,尽快执行']"
"《关于建国以来党的若干历史问题的决议》不仅对建国以来党的重大历史事件、毛泽东的功过是非以及毛泽东思想的基本内容与指导意义作出了总结和评价,而且还初步总结了十一届三中全会以来,我们党已经逐步确立的一条适合我国情况的社会主义现代化建设的正确道路的().","['八个主要点', '十个主要点', '十二个主要点']",['十个主要点']
加快建设贸易强国.营造市场化、法制化、()一流营商环境,"['全球化', '国际化', '一体化', '多元化']",['国际化']
"十三大会议中提出,我们还要按照这个原则努力争取和平解决台湾问题.历史将证明,按()实现国家统一的构想和实践,是中华民族政治智慧的伟大创造.","['“九二共识”', '“一国两制”', '和平统一', '武装统一']",['“一国两制”']
".党在自己的工作中实行(),一切为了群众,一切依靠群众,从群众中来,到群众中去,把党的正确主张变为群众的自觉行动.","['群众路线', '联系群众', '以人民为中心', '坚持党的领导']",['群众路线']
"社会主义改造的和平性,体现在()","['对个体农业的社会主义改造中', '对个体手工业的社会主义改造中', '对资本主义工商业的社会主义改造中', '对官僚垄断资本的改造中']",['对资本主义工商业的社会主义改造中']
"《中共中央关于加强和改进新形势下党的建设若干重大问题的决定》指出,坚持德才兼备、以()为先用人标准.","['廉', '德', '能', '政']",['德']
"大革命失败后,中国共产党创建的第一块农村革命根据地是().","['闽浙赣革命根据地', '井冈山革命根据地', '湘赣革命根据地', '闽西革命根据地']",['井冈山革命根据地']
"1947年6月30日,刘伯承和邓小平率晋冀鲁豫野战军主力突破黄河天险,挺进大别山,揭开了人民解放战争战略进攻的序幕.","['正确', '错误']",['正确']
"人民代表大会制度是坚持党的领导、人民当家作主、依法治国有机统一的根本政治制度安排,必须长期坚持、不断完善.","['正确', '错误']",['正确']
"1920年8月,陈独秀等领导建立的中国最早的共产党组织是().","['北京共产主义小组', '上海共产主义小组', '武汉共产主义小组', '广州共产主义小组']",['上海共产主义小组']
"在1925年至1927年中国反帝反封建的革命中,中国共产党起着独特的、不可代替的作用.没有中国共产党,不会有这场大革命.","['正确', '错误']",['正确']
"实施区域协调发展战略,要以城市群为主体构建大中小城市和小城镇协调发展的城镇格局,加快农业转移人口市民化.","['正确', '错误']",['正确']
我国对资本主义工商业进行社会主义改造的创新性办法是：(),"['剥夺生产资料', '和平赎买', '公私合营', '无偿没收']",['和平赎买']
"十二大全体会议中,”中共中央关于整党的决定”在()中全会中提出.","['二中全会', '三中全会', '五中全会', '七中全会']",['二中全会']
"坚持总体国家安全观,统筹发展和安全,坚决维护国家().","['发展利益', '安全', '稳定', '主权']","['发展利益', '安全', '主权']"
十九大全会习近平用()对新时代中国特色社会主义思想进行了阐述,"['“十四个坚持”', '“十个明确”', '“八个明确”', '“八个坚持”']",['“八个明确”']
"1925年爆发的(),掀起了全国范围的大革命高潮.","['废除不平等条约运动', '五卅运动', '省港大罢工']",['五卅运动']
"科学发展观第一次比较系统地回答了什么是社会主义、如何建设社会主义的问题,开拓了马克思主义中国化新境界.","['正确', '错误']",['正确']
"中国共产党强调,必须在统一战线中坚持独立自主的原则,其具体表现是().①共产党必须保持在思想上、政治上和组织上的独立性②放手发动群众,壮大人民力量③必须坚持党对军队的绝对领导④冲破国民党的限制和束缚,努力发展人民武装和抗日根据地⑤必须对国民党采取又团结又斗争、以斗争求团结的方针","['①③④', '①②③', '①②③④⑤', '②③']",['①②③④⑤']
发展党员工作应当按照控制总量、()的总要求.,"['强化思想', '优化结构', '提高质量', '发挥作用']","['优化结构', '提高质量', '发挥作用']"
第一次全面系统地阐述社会主义初级阶段理论的是在党的(),"['十一届三中全会', '十三大', '十四大']",['十四大']
中国共产党的()是中国共产党的象征和标志,"['党章', '党规', '党徽党旗']",['党徽党旗']
"1922年1月,()是第一次工人运动高潮的起点.","['沙面工人大罢工', '香港海员大罢工', '广州工人大罢工', '京汉铁路工人罢工']",['香港海员大罢工']
中国共产党在土地革命时期对待富农的正确政策是(),"['限制富农', '打击富农', '中立富农', '保护富农']",['限制富农']
中国共产党开创的第一个农村革命根据地是(),"['井冈山', '湘鄂西', '左右江', '鄂豫皖']",['井冈山']
"十八届二中全会指出,要进步做好保障和改善民生工作,时刻把群众安危冷暖放在心上,落实好各项惠民政策,完善基本公共服务体系,加大对扶贫对象和贫困地区的扶持力度,不断在实现全体人民()、住有所居目标上取得实实在在的进展.","['学有所教', '劳有所得', '病有所医', '老有所养']","['学有所教', '劳有所得', '病有所医', '老有所养']"
"林彪反革命集团阴谋夺取最高权力,策动反革命武装政变事件的发生,客观上宣告了“文革”理论和实践的失败.","['正确', '错误']",['正确']
"中国人民政治协商会议第一届全体会议选举毛泽东为中央人民政府主席,()、李济深、张澜、高岗为副主席","['朱德', '刘少奇', '宋庆龄', '林彪']","['朱德', '刘少奇', '宋庆龄']"
不属于中共一大通过的党纲内容的是联合共产国际,"['正确', '错误']",['正确']
"党的十八届五中全会提出,“十三五”要深化户籍制度改革,促进有能力在城镇稳定就业和生活的()进城落户,并与城镇居民有同等权利和义务.","['农业转移人口举家', '农业转移人口本人', '农业转移人口亲属']",['农业转移人口举家']
"党在新民主主义革命时期的土地革命总路线是:依靠贫下中农,孤立富农,有步骤地,有分别地消灭封建剥削制度,发展农业生产.","['正确', '错误']",['错误']
"党的地方各级代表大会代表的名额和选举办法,由()决定,并报上一级党的委员会批准.","['同级党的委员会', '同级党的委员会的常务委员会', '上一级党的委员会']",['同级党的委员会']
"1936年10月,红军三大主力会师的地点是会宁.","['正确', '错误']",['正确']
"2017年,习近平在中国共产党第十八届中央纪律检查委员会第七次全体会议上指出,管党治党从宽松软走向(),需要经历一个砥砺淬炼的过程.","['严', '硬', '实', '紧']","['严', '硬', '紧']"
"2017年,习近平在中国共产党第十八届中央纪律检查委员会第七次全体会议上强调,要坚决打赢()这场正义之战.","['激励', '问责', '思想', '组织']",['问责']
"中共七届二中全会的决议和毛泽东的《论人民民主专政》,构成了《中国人民政治协商会议共同纲领》的基础.","['正确', '错误']",['正确']
中国共产党是最高().,"['A政治领导力量', 'B政治团体', 'C领导机构']",['A政治领导力量']
"十九大习近平说,新时代中国特色社会主义思想明确坚持和发展中国特色社会主义,总任务是()","['实现社会主义现代化', '实现社会主义现代化和中华民族伟大复兴,', '实现民族伟大复兴', '建设中国特色社会主义理论体系']","['实现社会主义现代化和中华民族伟大复兴,']"
"中国共产党能够明确提出反帝反封建的民主革命纲领,最主要的原因是()","['工人运动受挫折', '党具有广泛的群众基础', '党正确分析了国情', '共产国际的支持']",['党正确分析了国情']
"由外国的传教士参加编撰,系统地介绍了欧洲的天文学著作,吸收了欧洲历法的成果的著作是().","['《大统历》', '《崇祯历书》', '《大明历》', '《太初历》']",['《崇祯历书》']
"十二五”规划确定以()为主题,以加快转变经济发展方式为主线.","['调整结构', '协调发展', '科学发展', '深化改革']",['科学发展']
党在社会主义初级阶段基本路线的核心是(),"['以经济建设为中心', '坚持四项基本原则', '坚持改革开放']",['以经济建设为中心']
"以党的政治建设为统领,全面推进党的政治建设、(),把制度建设贯穿其中,深入推进反腐败斗争,全面提高党的建设科学化水平.","['纪律建设', '作风建设', '组织建设', '思想建设']","['纪律建设', '作风建设', '组织建设', '思想建设']"
"南昌起义后,中共中央在湖北武汉召开(),确定了土地革命的方针.","['党的三大', '党的四大', '八七会议', '党的七大']",['八七会议']
"中央八项规定要求,要精简会议活动,切实改进会风；提高会议实效,().","['开短会', '讲短话', '力戒空话', '力戒套话']","['开短会', '讲短话', '力戒空话', '力戒套话']"
实行党政领导干部任职()制度,"['考察', '回避', '试用', '公示']",['回避']
基督教在中国设立的最大出版机构广学会发行的报刊是(),"['《中国丛报》', '《北华捷报》', '《子林西报》', 'D、《万国公报》']",['D、《万国公报》']
党的十六大召开的时间是().,"['1997年', '2002年', '2007年', '2013年']",['2002年']
"《中华人民共和国刑法》规定国家工作人员的财产、支出明显超过合法收入,差额巨大的,可以责令该国家工作人员说明来源,不能说明来源的,差额部分以非法所得论.","['正确', '错误']",['正确']
"十九大报告指出,要完善农业支持保护制度,发展多种形式适度规模经营,培育新型农业经营主体,健全农业社会化服务体系.","['正确', '错误']",['正确']
"中国共产党领导人民建设社会主义生态文明,增强()的意识.","['只要绿水青山', '绿水青山就是金山银山', '宁要金山银山不要绿水青山']",['绿水青山就是金山银山']
毛泽东提出“枪杆子里面出政权”的著名论断是在遵义会议上.,"['正确', '错误']",['错误']
我国新民主主义社会革命阶段的基本结束和社会主义革命阶段开始的标志是：(),"['新中国的成立', '土地改革的完成', '社会主义改造的完成', '过渡时期的结束']",['新中国的成立']
邓小平提出在改革开放过程中必须坚持的四项基本原则是(),"['坚持社会主义道路', '坚持人民民主专政', '坚持共产党的领导', '坚持马列主义、毛泽东思想']","['坚持社会主义道路', '坚持人民民主专政', '坚持共产党的领导', '坚持马列主义、毛泽东思想']"
"纪律检查机关依规依纪进行执纪审查,重点审查()的领导干部","['不收敛不收手', '问题线索反映集中、群众反映强烈', '不按规定如实报告个人有关事项', '现在重要岗位且可能还要提拔使用']","['不收敛不收手', '问题线索反映集中、群众反映强烈', '现在重要岗位且可能还要提拔使用']"
"中共之所以能够明确地提出彻底反帝反封建的民主革命纲领,最主要的原因是().","['中共是无产阶级政党', '中共正确分析和认识了中国国情', '中共得到共产国际的指导', '中共具有广泛的群众基础']",['中共正确分析和认识了中国国情']
"某党支部党员小王最近在互联网社交媒体上转发了一篇歪曲人民军队历史、污蔑英雄的文章,还作了点评表示认可其中的观点,造成不良影响.该党支部召开支部委员会会议,决定对小王给以警告处分,并向支部的全体党员及小王本人宣布了处分决定.该支部的做法()","['对.党支部应及时对违纪党员作出处分', '不对.党支部委员会会议讨论决定后应报党的基层委员会批准', '不对.对党员的纪律处分,必须经过支部大会讨论决定,报党的基层委员会批准']","['不对.对党员的纪律处分,必须经过支部大会讨论决定,报党的基层委员会批准']"
"1979年4月,中央工作会议决定对国民经济实行大八字方针是().","['调整、巩固、充实、提高', '调整、改革、充实、提高', '调整、改革、整顿、提高', '调整、改革、整顿、发展']",['调整、改革、整顿、提高']
十九大的主题是：,"['：高举中国特色社会主义伟大旗帜,以邓小平理论、“三个代表”重要思想、科学发展观为指导,解放思想,改革开放,凝聚力量,攻坚克难,坚定不移沿着中国特色社会主义道路前进,为全面建成小康社会而奋斗.', '不忘初心,牢记使命,高举中国特色社会主义伟大旗帜,决胜全面建成小康社会,夺取新时代中国特色社会主义伟大胜利,为实现中华民族伟大复兴的中国梦不懈奋斗.', '高举中国特色社会主义伟大旗帜,以邓小平理论和“三个代表”重要思想为指导,深入贯彻落实科学发展观,继续解放思想,坚持改革开放,推动科学发展,促进社会和谐,为夺取全面建设小康社会新胜利而奋斗.']","['不忘初心,牢记使命,高举中国特色社会主义伟大旗帜,决胜全面建成小康社会,夺取新时代中国特色社会主义伟大胜利,为实现中华民族伟大复兴的中国梦不懈奋斗.']"
党的十三大第一次把社会主义初级阶段作为事关全局的基本国情加以把握明确了这一问题是制定路线、方针、政策的出发点和根本依据.,"['正确', '错误']",['正确']
"《中共中央办公厅国务院办公厅关于严禁党政机关及其工作人员在公务活动中接受和赠送礼金、有价证券的通知》规定,各级党政机关及其工作人员凡违反规定接受礼金和有价证券者要坚决追究根据(),给予党纪、政纪处分.","['数额多少和情节轻重', '收受时间', '次数多少', '收受理由']",['数额多少和情节轻重']
"《中华人民共和国国家安全法》第四十二条规定,()依法搜集涉及国家安全的情报信息.","['国家安全机关', '检察机关', '审判机关', '公安机关']","['国家安全机关', '公安机关']"
党的()制定了党在社会主义初级阶段的基本纲领,"['十三大', '十四大', '十五大']",['十三大']
标志着中国共产党开始独立领导革命战争和创建人民军队的事件是().,"['秋收起义', '广州起义', '南昌起义', '百色起义']",['南昌起义']
