question,options,right_answer
"党的地方各级纪律检查委员会和基层纪律检查委员会如果对同级党的委员会处理案件的决定有不同意见,可以请求()予以复查.","['中央纪律检查委员会', '上一级纪律检查委员会', '上一级党的委员会']",['上一级纪律检查委员会']
"()国家恢复高考制度,全国高校重新通过同意考试招收新生.","['1977年', '1978年', '1979年', '1980年']",['1977年']
"强化不能腐的震慑,扎牢不想腐的笼子,增强不敢腐的自觉,通过不懈努力换来海晏河清、朗朗乾坤.","['正确', '错误']",['错误']
明确提出中国共产党在民主革命时期纲领的是(),"['中共一大', '中共二大', '中共三大', '中共四大']",['中共二大']
"2017年,习近平在中国共产党第十八届中央纪律检查委员会第七次全体会议上指出,从不敢、不能到不想,要靠铸牢()这个共产党人的魂.","['路', '力', '魂', '神']",['魂']
毛泽东思想被确立为党的指导思想是在中共二大.,"['正确', '错误']",['错误']
"1986年11月,我国政府决定进一步增加对外国人开放的地区,由244个增加到().","['300个', '395个', '436个']",['436个']
毛泽东思想是在()什么时期成熟的.,"['土地革命战争时期', '抗日战争中后期', '解放战争时期']",['抗日战争中后期']
"在人民解放军渡江作战时,()国“紫石英号”等四艘军舰阻碍我军渡江,受到解放军的痛击.","['美', '英', '法']",['英']
"中共“六大”批评了瞿秋白“左”倾盲动主义错误,正确指出国民革命失败后中国社会的性质仍然是半殖民地半封建社会.","['正确', '错误']",['正确']
惩治腐败应该坚持(),"['零容忍态度', '宽容态度', '救免态度', '有条件赦免态度']",['零容忍态度']
邓小平理论是当代中国毛泽东思想.,"['正确', '错误']",['错误']
下列哪些属于党内监督的主要内容(),"['遵守党章党规,坚定理想信念,践行党的宗自,模范遵守宪法法律情况', '维护党中央集中统一领导,牢固树立政治意识、大局意识、核心意识、看齐意识,贯彻落实党的理', '坚持民主集中制,严肃党内政治生活,贯彻党员个人服从党的组织,少数服从多数,下级组织服从上级组织,全党各个组织和全体党员服从党的全国代表大会和中央委员会原则情况', '落实全面从严治党责任,严明党的纪律特别！是政治纪律和政治规矩,推进党风廉政建设和反腐败工作情況']","['遵守党章党规,坚定理想信念,践行党的宗自,模范遵守宪法法律情况', '维护党中央集中统一领导,牢固树立政治意识、大局意识、核心意识、看齐意识,贯彻落实党的理', '坚持民主集中制,严肃党内政治生活,贯彻党员个人服从党的组织,少数服从多数,下级组织服从上级组织,全党各个组织和全体党员服从党的全国代表大会和中央委员会原则情况', '落实全面从严治党责任,严明党的纪律特别！是政治纪律和政治规矩,推进党风廉政建设和反腐败工作情況']"
下列关于党组的说法正确的有().,"['党组必须服从批准它成立的党组织领导', '党组只能设书记,不能设副书', '党组设书记,必要时还可以设副书记', '党组的成员,由批准成立党组的党组织决定']","['党组必须服从批准它成立的党组织领导', '党组设书记,必要时还可以设副书记', '党组的成员,由批准成立党组的党组织决定']"
中国革命胜利后建立的社会是社会主义社会,"['正确', '错误']",['错误']
"抗日战争胜利后,为争取全国人民渴望的和平民主,中国共产党和国民党举行了().","['重庆谈判', '延安谈判', '西安谈判']",['重庆谈判']
"深入贯彻落实科学发展观,要求我们().","['始终坚持“一个中心、两个基本点”的基本路线', '积极构建社会主义和谐社会', '继续深化改革开放', '切实加强和改进党的建设']","['始终坚持“一个中心、两个基本点”的基本路线', '积极构建社会主义和谐社会', '继续深化改革开放', '切实加强和改进党的建设']"
"()是第一个承认中华人民共和国,并与我国建立外交关系的国家.","['波兰', '苏联', '朝鲜', '保加利亚']",['苏联']
"2023年5月5日,二十届中央财经委员会第一次会议强调,加快建设以实体经济为支撑的现代化产业体系,关系我们在未来发展和国际竞争中赢得战略主动.要把握()等新科技革命浪潮,适应人与自然和谐共生的要求,保持并增强产业体系完备和配套能力强的优势,高效集聚(),推进产业(),建设具有()的现代化产业体系.","['人工智能', '全球创新要素', '智能化、绿色化、融合化', '完整性、先进性、安全性']","['人工智能', '全球创新要素', '智能化、绿色化、融合化', '完整性、先进性、安全性']"
"2017年,习近平在中国共产党第十八届中央纪律检查委员会第七次全体会议上强调,应从问题入手,深化改革,确保()在正确的轨道上运行.","['“两学一做”', '三严三实', '中央八项规定', '廉洁从政']",['中央八项规定']
"我国的社会主义建设,必须从我国的国情出发,走中国特色社会主义道路,以()全面推进中华民族伟大复兴.","['四个现代化', '中国化现代化', '全体人民共同富裕']",['中国化现代化']
"十八大以来,以习近平同志为主要代表的中国共产党人,坚持把马克思主义基本原理同()相结合、同()相结合,科学回答了新时代坚持和发展什么样的中国特色社会主义、怎样坚持和发展中国特色社会主义等重大时代课题,创立了习近平新时代中国特色社会主义思想.","['世界百年未有之大变局', '中华优秀传统文化', '党情国情世情', '中国具体实际']","['中华优秀传统文化', '中国具体实际']"
"建设生态文明必须从源头抓起,把作为根本之策.","['节约资源', '消耗资源', '降低污染', '减少排放']",['节约资源']
"坚持协调发展,必须牢牢把握中国特色社会主义事业总体布局,正确处理发展中的重大关系,重点促进城乡区域协调发展,促进经济社会协调发展,促进新型()、信息化、城镇化、农业现代化同步发展.","['工业化', '现代化', '智能化']",['工业化']
"要深化文化体制改革,完善文化管理体制,加快构建把经济效益放在首位、社会效益和经济效益相统一的体制机制.","['正确', '错误']",['错误']
中国特色社会主义文化“三个面向”是指什么(),"['面向现代化', '面向世界', '面向未来', '面向国际']","['面向现代化', '面向世界', '面向未来']"
"建国初期,人民政府为稳定市场,严厉打击投机倒把活动,经过银元之战、米棉之战,稳定了物价,结束了国民党统治自抗战以来物价暴涨的局面.","['正确', '错误']",['正确']
五四运动标志着中国旧民主主义革命的开端.,"['正确', '错误']",['错误']
"公有制经济组织中党的基层组织,贯彻党的方针政策,引导和监督企业遵守国家的法律法规,领导工会、共青团等群团组织,团结凝聚职工群众,维护各方的合法权益,促进企业健康发展.","['正确', '错误']",['错误']
"凡属重大问题,党的各级委员会都要按照集体领导、民主集中、()、会议决定的原则,由党的委员会集体讨论,作出决定；委员会成员要根据集体的决定和分工,切实履行自己的职责.","['个别酝酿', '个别商谈', '集中酝酿']",['个别酝酿']
中国共产党推动建设持久和平、()、共同繁荣、()、()的世界.,"['共建共享交流互鉴绿色低碳', '普遍安全开放包容清洁美丽', '普遍安全交流互鉴清洁美丽']",['普遍安全开放包容清洁美丽']
第一个中国共产党早期组织建立于(&nbsp;),"['上海', '北京', '武汉', '广州']",['上海']
1948年9月16日至24日的()揭开了人民解放军与国民党党军队战略决战的序幕.,"['鲁南战役', '胶济路西段战役', '济南战役']",['济南战役']
"在中国革命进程中,具有新民主主义革命和社会主义革命双重性质的事件是：()","['没收地主阶级的土地归农民所有', '没收官僚资本归新民主主义国家所有', '没收帝国主义在华企业归新民主主义国家所有', '赎买民族工商业归人民民主专政国家所有']",['没收官僚资本归新民主主义国家所有']
"(学习二十大)9此题为防刷题而出,正常答题的同学请退出后再次进入答题或选择AB选项,否则容易被判定为刷题.(请注意:如果在意正确率,请退出再重进;如果不在意正确率,那么请选择AB选项)","['选它', '选它', '1', '1']","['选它', '1']"
"2015年10月18日,中共中央印发了《中国共产党廉洁自律准则》(《准则》)明确指出()","['《准则》是党执政以来第一部坚持正面倡导、面向党员领导干部的规范全党廉洁自律工作的重要基础性法规', '《准则》重在立规,是对党章规定的具体化', '《准则》强调坚持理想信念宗旨高标准', '《准则》由中央纪委负责解釆']",['《准则》强调坚持理想信念宗旨高标准']
"从1966年到1975年,我国在国防尖端技术方面取得的成就有().","['成功进行了导弹核武器的发射试验', '第一艘核潜艇建成并试航成功', '成功发射了第一颗人造地球卫星']","['成功进行了导弹核武器的发射试验', '第一艘核潜艇建成并试航成功', '成功发射了第一颗人造地球卫星']"
中国早期共产党组织成立后出版的工人通俗刊物包括().①《劳动界》②《劳动音》③《劳动者》④《劳动与妇女》,"['①②③', '②③④', '③④', '①②③④']",['①②③④']
十年社会主义建设时期大体可分为三个阶段.其中的第二个阶段是(),"['基本执行正确路线的三年.', '经济工作严重失误的三年.', '社会主义建设健康发展,并取得重大胜利的三年.']",['经济工作严重失误的三年.']
"2010年7月23日,胡锦涛在中共中央政治局第二十二次集体学习时指出,改革开放以来,我国文化建设加快发展、文化日益繁荣,开创了().","['文化体制改革新进程', '中国特色社会主义文化建设新局面', '市场经济条件下文化产业发展新格局', '社会主义文化事业发展新天地']",['中国特色社会主义文化建设新局面']
"《关于实行党风廉政建设责任制的规定》规定,实行党风廉政建设责任制,要坚持党委统一领导,(),纪委组织协调,部门各负其责,依靠群众的支持和参与.","['党政齐抓共管', '依纪依法办案', '政府主要负责', '专门机关监督']",['党政齐抓共管']
各级()负责《廉政准则》的贯彻实施.,"['人大', '政府', '党委(党组)', '纪委']",['党委(党组)']
"党的县(旗)、自治县、不设区的市和市辖区的委员会,每届任期5年.这些委员会的委员和候补委员必须有()年以上的党龄.","['3', '4', '5']",['3']
"新民主主义革命时期,在上海召开的中国共产党全国代表大会是().","['一大二大三大', '二大三大五大', '一大二大四大']",['一大二大四大']
以下不属于党员义务的是().,"['对党的工作提出倡议', '学习党的基本知识和党的历史', '增强“四个意识”、坚定“四个自信”、做到""两个维护”']",['对党的工作提出倡议']
党在过渡时期总路线的核心是().,"['“一化三改”', '经济建设', '改革开放']",['“一化三改”']
新民主主义革命的核心问题是(),"['无产阶级的领导权', '农民问题', '武装斗争问题', '政权问题']",['无产阶级的领导权']
"2013年3月17日,习近平在第十二届全国人民代表大会第一次会议上指出,实现全面建成小康社会、建成富强民主文明和谐的社会主义现代化国家的奋斗目标,实现中华民族伟大复兴的中国梦,就是要实现()、()、(),既深深体现了今天中国人的理想,也深深反映了我们先人们不懈追求进步的光荣传统.","['国家富强', '民族振兴', '人民幸福']","['国家富强', '民族振兴', '人民幸福']"
"党必须按照()的原则,在同级各种组织中发挥领导核心作用.","['统筹全局、协调各方', '总揽全局、协调各方', '总揽全局、指挥各方']",['总揽全局、协调各方']
"1984年9月26日,中英两国政府在关于香港问题的联合声明中宣布：中国政府决定在1997年7月1日().","['对香港恢复行使主权', '收回香港', '对香港行使主权']",['对香港恢复行使主权']
"加强社会主义核心价值体系建设,坚持马克思主义指导思想,树立中国特色社会主义共同理想,弘扬以爱国主义为核心的民族精神和以()为核心的时代精神.","['诚信友善', '爱岗敬业', '改革创新']",['改革创新']
经过辽沈、淮海、平津三大战役(),"['解放了黄河以北广大地区', '国民党赖以推持反动统治的主要军事力量被消灭', '迫使蒋介石退守台湾']",['解放了黄河以北广大地区']
"()在中央委员会全体会议闭会期间,行使中央委员会的职权.","['中央政治局', '中央政治局和它的常务委员会', '中央政治局常务委员会']",['中央政治局和它的常务委员会']
"毛泽东在()一文中,总结了中国革命两次胜利和两次失败的经验教训,揭示了中国革命发展的客观规律","['《中国革命和中国共产党》', '《在晋绥干部会议上的讲话》', '《新民主主义论》', '《<共产党人>发刊词》']",['《<共产党人>发刊词》']
"2013年3月11日,习近平在十二届全国人大一次会议解放军代表团全体会议上指出,要推动()建设加速发展,扎实抓好新型()建设,大力发展高新技术武器装备,加快全面建设现代后勤步伐,加强高素质新型()培养,深化国防和军队改革,构建()现代军事力量体系.","['信息化', '作战力量', '军事人才', '中国特色']","['信息化', '作战力量', '军事人才', '中国特色']"
"坚持社会主义道路、坚持人民民主专政、坚持()、坚持马克思列宁主义毛泽东思想这四项基本原则,是我们的立国之本.","['中国共产党的领导', '新发展理念', '以经济建设为中心']",['中国共产党的领导']
《关于建国以来党的若干历史问题的决议》一共分为6个部分.,"['正确', '错误']",['错误']
"领导干部特别是高级干部必须注重(),教育管理好亲属和身边工作人员","['家训', '家庭', '家教', '家风']","['家庭', '家教', '家风']"
"在中国共产党的历史上,第一次提出执政党建没问题的是()","['中共七大', '中共七届二中全会', '中共七届三中全会', '中共七届四中全会']",['中共七届二中全会']
"在1946年1月至1948年11月的东京审判中,担任中国驻远东国际军事法庭法律代表团团长、首席检查官和首席法官的是()","['沈家本', '顾维钧', '梅汝', '伍廷芳']",['顾维钧']
"为了坚持、巩固和扩大抗日民族统一战线,中国共产党制定了()的策略总方针.","['“发展进步势力,争取中间势力,孤立顽固势力”', '“发展进步势力,争取顽固势力,孤立中间势力”', '“争取进步势力,发展中间势力,孤立顽固势力”', '“争取进步势力,发展顽固势力,孤立中间势力”']","['“发展进步势力,争取中间势力,孤立顽固势力”']"
"2014年10月23日,中共十八届四中全会通过的《中共中央关于全面推进依法治国若干重大问题的决定》提出,全面推进依法治国,总目标是建设中国特色社会主义法治体系,建设社会主义法治国家,促进国家治理体系和治理能力现代化.其特征是()","['科学立法', '严格执法', '公正司法', '全民守法']","['科学立法', '严格执法', '公正司法', '全民守法']"
王明“左”倾冒险主义的使党在白区的革命力量几乎损失了100%.,"['正确', '错误']",['正确']
对中国近代史上两次国共合作表述正确的是()①都出现在20世纪20年代②都是在中共的努力下促成③都推动了中国革命的发展④都有利于当时社会主要矛盾的解决,"['①②③', '②③④', '①③④', '①②④']",['②③④']
中国式现代化有()个重要特征.,"['三', '四', '五', '六']",['五']
"大革命失败后,中国共产党领导的三大武装起义是南昌起义、秋收起义、湘赣起义.","['正确', '错误']",['错误']
供给侧和需求侧是管理和调控宏观经济的两个基本手段.,"['正确', '错误']",['正确']
邓小平在中共十二大开幕词中().,"['深刻概括了社会主义的本质', '鲜明提出了四项基本原则', '系统阐述了社会主义初级阶段理论', '明确提出了建设有中国特色社会主义的命题']",['明确提出了建设有中国特色社会主义的命题']
"()年底,社会主义改造取得决定性的胜利,基本消灭了剥削制度,全民所有制和劳动群众集体所有制这两种社会主义公有制形式,已在国民经济中占据绝对优势地位.","['1953', '1954', '1955', '1956']",['1956']
十八大提出的“四大考验”是什么？(),"['国内环境考验', '改革开放考验', '市场经济考验', '外部环境考验', '执政考验']","['改革开放考验', '市场经济考验', '外部环境考验', '执政考验']"
中国共产党举起武装抗日的旗帜的行动是(),"['1931年9月20日中共中央发表宣言,揭露日本侵占东北的目的', '发布一系列文告,号召全国工农武装起来,进行民族的自卫战争', '1932年4月15日,中华苏维埃共和国临时中央政府宣布对日作战', '直接领导了东北人民的抗日武装斗争']","['1931年9月20日中共中央发表宣言,揭露日本侵占东北的目的', '发布一系列文告,号召全国工农武装起来,进行民族的自卫战争', '1932年4月15日,中华苏维埃共和国临时中央政府宣布对日作战', '直接领导了东北人民的抗日武装斗争']"
"党的各级纪律检查委员会是党內监督的专责机关,承担下列具体任务","['领导本地区本部门本单位党内监督工作,组织实施各项监督制度,抓好督促检查', '加强对同级党委特别是常委会委员、党的工作部门和直接领导的党组织、党的领导干部履行职责、行使权力情况的监督', '落实纪律检查工作双重领导体制,执纪审查工作以上级纪委领导为主,线索处置和执纪审查情况在向同级党委报告的同时向上级纪委报告,各级纪委书记、副书记的提名和考察以上级纪委会同组织部门为主', '强化上级纪委对下级纪委的领导,纪委发现同级党委主要领导干部的问题,可以直接向上级纪委报告；下级纪委至少每半年向上级纪委报告1次工作,每年向上级纪委进行述职']","['加强对同级党委特别是常委会委员、党的工作部门和直接领导的党组织、党的领导干部履行职责、行使权力情况的监督', '落实纪律检查工作双重领导体制,执纪审查工作以上级纪委领导为主,线索处置和执纪审查情况在向同级党委报告的同时向上级纪委报告,各级纪委书记、副书记的提名和考察以上级纪委会同组织部门为主', '强化上级纪委对下级纪委的领导,纪委发现同级党委主要领导干部的问题,可以直接向上级纪委报告；下级纪委至少每半年向上级纪委报告1次工作,每年向上级纪委进行述职']"
"共青团的地方各级组织受()领导,同时受()领导.","['上级党的委员会,共青团上级组织', '同级党的委员会,共青团上级组织', '共青团上级组织,党的全国代表大会']","['同级党的委员会,共青团上级组织']"
"1937年8月,南方红军和游击队,除琼崖红军游击队外,改编为国民革命军陆军新编第四军,()任军长.","['陈毅', '叶挺', '刘少奇', '项英']",['叶挺']
"1980年8月22日,邓小平在会见美国共和党副总统候选人布什时指出：不管美国1980年大选后哪一个党执政,中国政府评价和判断美国政府的战略决策和对外政策都将把对中国的政策视为最重要的标志之一,因为这是一个()的问题.","['两大国', '区域性重大', '全球战略']",['全球战略']
"1998年11月21日,中共中央发出《关于在县级以上党政领导班子、领导干部中深入开展以()为主要内容的党性党风教育的意见》.“三讲”教育由此开始.","['讲学习', '讲廉洁', '讲政治', '讲正气']","['讲学习', '讲政治', '讲正气']"
"2017年,习近平在中国共产党第十八届中央纪律检查委员会第七次全体会议上指出,()是我们党管党治党的一贯要求.","['淡泊名利', '修身立德', '全心全意为人民服务', '坚定理想信念']",['修身立德']
"党的领导干部应当每年在党委常委会(或党组)扩大会议上述责述廉,接受评议.述责述廉重点是哪些情況？","['执行政治纪律和政治规矩', '推进党风廉政建设和反腐败工作', '执行廉洁纪律']","['执行政治纪律和政治规矩', '推进党风廉政建设和反腐败工作', '执行廉洁纪律']"
下列选项中属于如何扎实推进社会主义文化强国建设的选项有(),"['加强社会主义核心价值体系建设', '全面提高公民道德素质', '丰富人民精神文化生活', '增强文化整体实力和竞争力']","['加强社会主义核心价值体系建设', '全面提高公民道德素质', '丰富人民精神文化生活', '增强文化整体实力和竞争力']"
"1953年,党对资本主义工商业的政策,概括为“()”.","['利用', '限制', '改造', '升级']","['利用', '限制', '改造']"
人与自然是生命共同体.,"['正确', '错误']",['正确']
坚持和完善人民代表大会制度、中国共产党领导的多党合作和政治协商制度、民族区域自治制度以及().,"['村民代表大会制度', '民主集中制', '基层群众自治制度']",['基层群众自治制度']
"党的中央和地方各级委员会在必要时召集代表会议,讨论和决定需要及时解决的重大问题.代表会议代表的名额和产生办法,由召集代表会议的()决定.","['常委会', '委员会', '全体委员']",['委员会']
"1937年8月22日至25日,中共中央在陕北洛川召开政治局扩大会议.会议通过了著名的().","['《中国共产党抗日救国十大纲领》', '《中共中央公布国共合作宣言》', '《抗日救国告全体同胞书》']",['《中国共产党抗日救国十大纲领》']
"1927年6月,中共中央政治局会议通过的()是党的历史上唯一不是由党的代表大会制定和修改的党章.","['《中国共产党第一次修正章程决案》', '《中国共产党第二次修正章程决案》', '《中国共产党第三次修正章程决案》']",['《中国共产党第三次修正章程决案》']
"新中国成立当天,在青海的第()班禅额尔德尼·确吉坚赞致电毛泽东主席、朱德总司令,表示拥护中央政府,希望早日解放西藏.","['十世', '十一世', '十三世', '十四世']",['十世']
"2023年2月26日至28日,中国共产党第二十届中央委员会第()次全体会议在北京举行.习近平就《党和国家机构改革方案(草案)》向全会作了说明.","['一', '二', '三', '四']",['二']
党的各级领导干部必须信念坚定、为民服务、勤政务实、()、清正廉洁.,"['勇挑重任', '敢于担当', '不怕困难']",['敢于担当']
"十二大会议中提出,在有限的耕地上生产出更多的粮食和经济作物,并且全面发展()、()、副、()各业,以满足工业发展和人民生活提高的需要.","['林', '牧', '渔', '种植']","['林', '牧', '渔']"
"全党同志一定要永远与人民()、()、(),永远把人民对美好生活的向往作为奋斗目标,以永不懈怠的精神状态和一往无前的奋斗姿态,继续朝着实现中华民族伟大复兴的宏伟目标奋勇前进.","['同呼吸', '共命运', '手牵手', '心连心']","['同呼吸', '共命运', '心连心']"
"十年来,我们经历了对党和人民事业具有重大现实意义和深远历史意义的三件大事：一是(),二是(),三是(),实现第一个百年奋斗目标.","['迎来中国共产党成立一百周年', '中国特色社会主义进入新时代', '完成脱贫攻坚、全面建成小康社会的历史任务', '实现社会主义现代化']","['迎来中国共产党成立一百周年', '中国特色社会主义进入新时代', '完成脱贫攻坚、全面建成小康社会的历史任务']"
"1927年,中国共产党确定土地革命和武装反抗国民党反动派方针的会议是(&nbsp;)","['八七会议', '古田会议', '赣南会议', '十二月会议']",['八七会议']
"在党的全国代表大会闭会期间,()执行全国代表大会的决议,领导党的全部工作,对外代表中国共产党","['中央委员会常务委员会', '中央委员会', '中央委员总书记']",['中央委员会']
"1938年,毛泽东发表了()科学地预见了抗日战争将经过战略防御、相持、反攻三个阶段.","['《论持久战》', '《中国共产党在民族战争中的地位》', '《中国的特点和革命战争》', '《论十大关系》']",['《论持久战》']
